{
  "$schema": "../../../schemas/design-tokens.v1.schema.json",
  "schemaVersion": 1,
  "tokenSetId": "cinderpost-grove",
  "revision": 1,
  "description": "Art direction for cinderpost: Warm agricultural greens over red clay. The farm direction, kept because it is right for what it was authored for -- but on this value ladder rather than the flat one. Values from the shared ladder; hues from the grove key.",
  "provenance": {
    "derivation": "art-direction-decision",
    "authoredBy": "rqe.art.direction",
    "authoredAt": "2026-08-11",
    "note": "Art key 'grove', selected from the brief. Derived from base token set 'brickfarm', whose scale, spacing, typography, motion, cameras and audio come through unchanged; only the palette colours and the moods are re-decided. Role luminances come from rqe.art.direction.VALUE_LADDER, which is shared by every art key and was set from reference measurements -- never from a capture of the game this set governs."
  },
  "scale": {
    "character": {
      "height": 5.0,
      "width": 2.0,
      "walkSpeed": 16,
      "jumpHeight": 7.2,
      "maxStepUp": 2.0,
      "comfortableSlopeDegrees": 45
    },
    "grammar": {
      "doorWidth": 8,
      "doorHeight": 11,
      "corridorWidth": 12,
      "ceilingHeight": 15,
      "stairRise": 1.4,
      "stairRun": 2.6,
      "railHeight": 3.5,
      "roomMinDimension": 20,
      "buildingMinFootprint": 24,
      "buildingMinHeight": 18,
      "landmarkMinHeight": 34,
      "plotMinDimension": 150,
      "avenueWidth": 58
    },
    "legibility": {
      "labelReadDistance": 26,
      "signageReadDistance": 120,
      "landmarkReadDistance": 900,
      "silhouetteReadDistance": 320
    }
  },
  "palette": {
    "harmony": {
      "maxHueFamilies": 5,
      "minLightnessSpread": 0.42,
      "accentTotalMaxCoverage": 0.1,
      "maxDeltaEToNearestRole": 12.0,
      "forbiddenMaterials": [
        "Neon",
        "ForceField",
        "Glass"
      ]
    },
    "roles": {
      "ground": {
        "srgb": [
          60,
          106,
          34
        ],
        "material": "Grass",
        "tier": "dominant",
        "usage": "Open grass. The base note of the whole world; every other colour is judged against it.",
        "minSurfaceCoverage": 0.18,
        "maxSurfaceCoverage": 0.62
      },
      "groundAlt": {
        "srgb": [
          52,
          93,
          29
        ],
        "material": "LeafyGrass",
        "tier": "supporting",
        "usage": "Grass variation that breaks up large flat fields without introducing a new hue.",
        "maxSurfaceCoverage": 0.3
      },
      "pavement": {
        "srgb": [
          143,
          132,
          112
        ],
        "material": "Cobblestone",
        "tier": "dominant",
        "usage": "Plaza and walkway surfacing. Carries circulation, so it must read as a route from above.",
        "maxSurfaceCoverage": 0.35
      },
      "pathPrimary": {
        "srgb": [
          201,
          131,
          110
        ],
        "material": "Ground",
        "tier": "supporting",
        "usage": "Main route paving. Warm against the grass so circulation is legible at a glance.",
        "maxSurfaceCoverage": 0.14
      },
      "pathAlt": {
        "srgb": [
          180,
          173,
          160
        ],
        "material": "Concrete",
        "tier": "supporting",
        "usage": "Alternating paving band, paired with pathPrimary.",
        "maxSurfaceCoverage": 0.14
      },
      "structurePrimary": {
        "srgb": [
          164,
          154,
          139
        ],
        "material": "Brick",
        "tier": "dominant",
        "usage": "Main building mass: walls, plot decks, pillars.",
        "maxSurfaceCoverage": 0.4
      },
      "structureSecondary": {
        "srgb": [
          144,
          93,
          48
        ],
        "material": "WoodPlanks",
        "tier": "supporting",
        "usage": "Recesses, plinths and shadow-side massing that give a facade depth.",
        "maxSurfaceCoverage": 0.28
      },
      "woodPrimary": {
        "srgb": [
          131,
          85,
          44
        ],
        "material": "WoodPlanks",
        "tier": "supporting",
        "usage": "Decking, beams, fences, crates.",
        "maxSurfaceCoverage": 0.3
      },
      "woodSecondary": {
        "srgb": [
          92,
          59,
          31
        ],
        "material": "Wood",
        "tier": "supporting",
        "usage": "Wood in shadow and structural framing.",
        "maxSurfaceCoverage": 0.2
      },
      "stonePrimary": {
        "srgb": [
          158,
          148,
          131
        ],
        "material": "Slate",
        "tier": "supporting",
        "usage": "Kerbs, foundations, retaining walls.",
        "maxSurfaceCoverage": 0.25
      },
      "stoneSecondary": {
        "srgb": [
          124,
          115,
          98
        ],
        "material": "Concrete",
        "tier": "supporting",
        "usage": "Weathered stone and lower courses.",
        "maxSurfaceCoverage": 0.2
      },
      "slate": {
        "srgb": [
          83,
          76,
          65
        ],
        "material": "Slate",
        "tier": "supporting",
        "usage": "Roofing and machinery housings.",
        "maxSurfaceCoverage": 0.2
      },
      "ink": {
        "srgb": [
          44,
          40,
          35
        ],
        "material": "Basalt",
        "tier": "supporting",
        "usage": "Outlines, panel backs, dark UI ground. Provides the contrast floor the whole palette is measured against.",
        "maxSurfaceCoverage": 0.22
      },
      "metal": {
        "srgb": [
          147,
          139,
          128
        ],
        "material": "Metal",
        "tier": "supporting",
        "usage": "Belt frames, rails, brackets.",
        "maxSurfaceCoverage": 0.18
      },
      "metalDark": {
        "srgb": [
          70,
          65,
          60
        ],
        "material": "CorrodedMetal",
        "tier": "supporting",
        "usage": "Machine bodies and belt underside.",
        "maxSurfaceCoverage": 0.15
      },
      "neutralLight": {
        "srgb": [
          236,
          234,
          231
        ],
        "material": "SmoothPlastic",
        "tier": "supporting",
        "usage": "Card faces, signage grounds, bright trim.",
        "maxSurfaceCoverage": 0.2
      },
      "vegetationLeaf": {
        "srgb": [
          89,
          157,
          50
        ],
        "material": "LeafyGrass",
        "tier": "supporting",
        "usage": "Canopy upper tiers.",
        "maxSurfaceCoverage": 0.22
      },
      "vegetationLeafDark": {
        "srgb": [
          81,
          143,
          45
        ],
        "material": "LeafyGrass",
        "tier": "supporting",
        "usage": "Canopy lower tiers, giving trees a readable silhouette.",
        "maxSurfaceCoverage": 0.18
      },
      "vegetationBark": {
        "srgb": [
          83,
          54,
          28
        ],
        "material": "Wood",
        "tier": "supporting",
        "usage": "Trunks and branches.",
        "maxSurfaceCoverage": 0.1
      },
      "water": {
        "srgb": [
          50,
          108,
          129
        ],
        "material": "Sand",
        "tier": "supporting",
        "usage": "Ponds and channels.",
        "maxSurfaceCoverage": 0.12,
        "reflectance": 0.15
      },
      "accentGold": {
        "srgb": [
          237,
          200,
          78
        ],
        "material": "SmoothPlastic",
        "tier": "accent",
        "usage": "Primary call to action: buy buttons, claim prompts, the one thing a player should look at.",
        "maxSurfaceCoverage": 0.03
      },
      "accentSuccess": {
        "srgb": [
          61,
          203,
          61
        ],
        "material": "SmoothPlastic",
        "tier": "accent",
        "usage": "Earned value, income figures, confirmation.",
        "maxSurfaceCoverage": 0.025
      },
      "accentDanger": {
        "srgb": [
          222,
          82,
          67
        ],
        "material": "SmoothPlastic",
        "tier": "accent",
        "usage": "Loss, locked state, destructive action.",
        "maxSurfaceCoverage": 0.015
      },
      "accentRare": {
        "srgb": [
          175,
          86,
          202
        ],
        "material": "SmoothPlastic",
        "tier": "accent",
        "usage": "Rarity signalling on cards and drops.",
        "maxSurfaceCoverage": 0.015
      }
    }
  },
  "spacing": {
    "base": 4,
    "steps": {
      "none": 0,
      "hair": 2,
      "tight": 4,
      "snug": 8,
      "base": 12,
      "roomy": 16,
      "loose": 24,
      "section": 32,
      "page": 48
    }
  },
  "typography": {
    "family": "GothamSSm",
    "base": 18,
    "ratio": 1.25,
    "steps": {
      "caption": 13,
      "body": 18,
      "label": 22,
      "subtitle": 28,
      "title": 36,
      "display": 46,
      "hero": 58
    },
    "weights": {
      "regular": "Regular",
      "medium": "Medium",
      "bold": "Bold"
    }
  },
  "motion": {
    "durations": {
      "instant": 0.08,
      "quick": 0.16,
      "base": 0.24,
      "slow": 0.4,
      "deliberate": 0.7
    },
    "easings": {
      "standard": {
        "style": "Quad",
        "direction": "Out"
      },
      "enter": {
        "style": "Back",
        "direction": "Out"
      },
      "exit": {
        "style": "Quad",
        "direction": "In"
      },
      "emphasis": {
        "style": "Elastic",
        "direction": "Out"
      },
      "linear": {
        "style": "Linear",
        "direction": "InOut"
      }
    }
  },
  "moods": {
    "grove-day": {
      "description": "Mid-afternoon with the sun off the shoulder. The default, and chosen for gameplay: long enough shadows to separate one mass from the next, high enough sun that nothing important is in the dark.",
      "lighting": {
        "technology": "Future",